{
  "schema_version": "1.0.0",
  "protocol_version": "1.2",
  "benchmark_type": "exporter-conformance",
  "run_id": "123e4567-e89b-12d3-a456-426614174000",
  "generated_at": "2026-09-12T18:00:00Z",
  "status": "pass",
  "summary": {
    "implementations": 1,
    "total_cases": 1,
    "passed_cases": 1,
    "failed_cases": 0,
    "pass_rate": 1.0,
    "event_count": 1,
    "output_bytes": 128,
    "duration_ms": 12.5,
    "schema_errors": 0,
    "privacy_violations": 0
  },
  "results": [
    {
      "implementation": "example-esra",
      "implementation_version": "1.0.0",
      "scenario_id": "fixture-cycle",
      "required": true,
      "status": "pass",
      "duration_ms": 12.5,
      "event_count": 1,
      "output_bytes": 128,
      "deterministic": true,
      "schema_errors": [],
      "privacy_violations": [],
      "errors": []
    }
  ]
}
